{
  "device": "mzi",
  "platform": "sin",
  "wavelength_nm": 1550,
  "delta_length_um": 0,
  "phase_control": {
    "phase_rad": 0,
    "active_length_um": 100
  },
  "outputs": [
    "netlist",
    "simulation",
    "gds",
    "verification"
  ],
  "tuning": {
    "targets": [
      {
        "input_port": "in0",
        "output_port": "out0",
        "wavelength_nm": 1550,
        "power": 0.8
      }
    ],
    "variables": [
      {
        "instance_path": [
          "top_arm"
        ],
        "min_phase_rad": 0,
        "max_phase_rad": 6.283185307179586
      }
    ],
    "power_tolerance": 1e-06,
    "max_evaluations": 128
  }
}
